ten,gia,giacu,soluong,motangan,motachitiet,ngay,trangthai,km,anh
Bó Hoa Young & Beautiful,349000,569000,283,,,2020-10-07,1,1,youngandbeautiful_1024x1024@2x.jpg
Giỏ Hoa Wonderland,1329000,,448,,,2020-10-07,1,1,wonderland_1024x1024@2x.jpg
Bó Hoa Under The Blue Sky,199000,369000,351,,,2020-10-07,1,1,UnderTheBlueSky_1024x1024@2x.jpg
Bó Hoa Sweet Desire,429000,,387,,,2020-10-07,1,1,SweetDesire_Transparent_01_1024x1024@2x.jpg
Giỏ Hoa Spring Garden,329000,499000,285,,,2020-10-07,1,1,SpringGarden_8a7fdabb-0ecd-4f76-82dc-5dd0583f2546_1024x1024@2x.jpg
Bó hoa Shining Ruby,949000,,339,,,2020-10-07,1,1,Shining-Ruby_1024x1024@2x.jpg
Bó Hoa Romantic Escape,599000,,339,,,2020-10-07,1,1,romance-escape_1024x1024@2x.jpg
Bó Hoa Cúc Tana Pure Joy,299000,529000,495,,,2020-10-07,1,1,purejoy_1024x1024@2x.jpg
Bó Hoa Pinky,319000,,125,,,2020-10-07,1,1,Pinky_1024x1024@2x.jpg
Bó Hoa Pinky Promise,549000,,398,,,2020-10-07,1,1,pink-promise-4_6a97191d-5eed-4693-96d7-e1881a8e408f_1024x1024@2x.jpg
Bó Hoa Pink Blush,299000,,367,,,2020-10-07,1,1,pinkblush_1024x1024@2x.jpg
Bó Hoa Passionate Love,639000,,361,,,2020-10-07,1,1,PassionateLove_1024x1024@2x.jpg
Bó Hoa Hồng Ecuador Only You,799000,,500,,,2020-10-07,1,1,onlyu_1_1024x1024@2x.jpg
Bó Hoa Angela,419000,,131,,,2020-10-07,1,1,nhieu-loai-hoa-bo-hoa-hong-cam-chuong-va-dong-tien-angela-1_1_1024x1024@2x.jpg
Ngày Tốt Lành!,239000,,350,,,2020-10-07,1,1,NgayT_tLanh_1024x1024@2x.jpg
Bó Hoa My Princess,419000,,196,,,2020-10-07,1,1,myprincess_1024x1024@2x.jpg
Bó Hoa My Juliet,329000,,121,,,2020-10-07,1,1,my-juliet-123_67324705-d8c5-4876-8168-139b8bca1a56_1024x1024@2x.jpg
Hộp Hoa Miss Globe,519000,,321,,,2020-10-07,1,1,MissGlobe_be47b391-1537-46d5-acb4-7c11b60f9d0b_1024x1024@2x.jpg
Bó Hoa Mindful Soul,259000,429000,353,,,2020-10-07,1,1,mindfulsoul_1024x1024@2x.jpg
Giỏ Hoa Midsummer,619000,,100,,,2020-10-07,1,1,midsum_1024x1024@2x.jpg
Bó Hoa Intense Love,539000,969000,203,,,2020-10-07,1,1,intense-love-1_1024x1024@2x.jpg
Bó Hoa My Only Sunshine,379000,629000,332,,,2020-10-07,1,1,hoa-baby-bo-hoa-my-only-sunshine-1_1024x1024@2x.jpg
Hộp Hoa Gỗ Sweet Tenderness,879000,,358,,,2020-10-07,1,1,H_pHoaG_SweetTenderness_1024x1024@2x.jpg
Hộp Hoa Gỗ Sweet Blossom,779000,,114,,,2020-10-07,1,1,H_pHoaG_SweetBlossom_1024x1024@2x.jpg
Hộp Hoa Gỗ Sunshine Box,619000,,404,,,2020-10-07,1,1,H_pHoaG_SunshineBox_1024x1024@2x.jpg
Hộp Hoa Gỗ Pretty Glory,589000,1119000,421,,,2020-10-07,1,1,H_pHoaG_PrettyGlory_1024x1024@2x.jpg
Hộp Hoa Gỗ Have A Sweet Day,619000,,301,,,2020-10-07,1,1,H_pHoaG_HaveASweetDay1_1024x1024@2x.jpg
Hộp Hoa Gỗ City Of Stars,469000,,220,,,2020-10-07,1,1,H_pHoaG_CityOfStars_bd7c9cb4-867e-4ee5-afc8-4ebf80ea6224_1024x1024@2x.jpg
Giỏ Hoa Lan Spring Light,1229000,,101,,,2020-10-07,1,1,Gi_HoaLanSpringLight_1024x1024@2x.jpg
Giỏ Hoa Lan Gentle Brightness,569000,,298,,,2020-10-07,1,1,Gi_HoaLanGentleBrightness_1024x1024@2x.jpg
Giỏ Hoa Lan Elegant In White,2159000,,420,,,2020-10-07,1,1,Gi_HoaLanElegantInWhite_1024x1024@2x.jpg
Giỏ Hoa Lan Delicacy Of The Moon,1369000,,267,,,2020-10-07,1,1,Gi_HoaLanDelicacyOfTheMoon_1024x1024@2x.jpg
Bó Hoa Gentle Love,759000,,175,,,2020-10-07,1,1,gentle-love-hcmc-hanoi_1024x1024@2x.jpg
Giỏ Hoa Cát Tường & Cẩm Chướng Trắng Eternal Bond,539000,,113,,,2020-10-07,1,1,eternalbonddd_1024x1024@2x.jpg
Giỏ hoa Diamond Love,569000,,104,,,2020-10-07,1,1,diamondlove_1024x1024@2x.jpg
Bó Hoa Day Dreamer,369000,,410,,,2020-10-07,1,1,daydreamer_1_1024x1024@2x.jpg
Hộp Hoa Gỗ Come And Kiss Me,519000,,483,,,2020-10-07,1,1,ComeAndKissMe_C_mTron1_1024x1024@2x.jpg
Chậu Hoa Lan Vanilla Butterfly,4499000,,102,,,2020-10-07,1,1,Ch_uHoaLanVanillaButterfly_1024x1024@2x.jpg
Chậu Hoa Lan Spring In Blossom,4059000,,401,,,2020-10-07,1,1,Ch_uHoaLanSpringInBlossom_1024x1024@2x.jpg
Chậu Hoa Lan Parade Of Magenta,1899000,,301,,,2020-10-07,1,1,Ch_uHoaLanParadeOfMagenta_1024x1024@2x.jpg
Chậu Hoa Lan Morning Dew,4059000,,381,,,2020-10-07,1,1,Ch_uHoaLanMorningDew_1024x1024@2x.jpg
Chậu Hoa Lan Midnight,1469000,,222,,,2020-10-07,1,1,Ch_uHoaLanMidnight_1024x1024@2x.jpg
Chậu Hoa Lan Melody Of Joy,2329000,,283,,,2020-10-07,1,1,Ch_uHoaLanMelodyOfJoy_1024x1024@2x.jpg
Chậu Hoa Lan Break Of Dawn,599000,,482,,,2020-10-07,1,1,Ch_uHoaLanBreakOfDawn_1024x1024@2x.jpg
Bó Hoa Yellow Garden,449000,,262,,,2020-10-07,1,1,BoHoaYellowGarden_87092941-9d4c-42d3-a3cf-5f0694af9c0a_1024x1024@2x.jpg
Bó Hoa Twilight,749000,,371,,,2020-10-07,1,1,BoHoaTwilight_1024x1024@2x.jpg
Bó Hoa The Ocean Breeze,499000,,397,,,2020-10-07,1,1,BoHoaTheOceanBreezeBridal_1024x1024@2x.jpg
Bó Hoa Thả Bình Oriental Bloom,329000,,329,,,2020-10-07,1,1,BoHoaTh_BinhOrientalBloom_1024x1024@2x.jpg
Bó Hoa Thả Bình Hoa Đất,1099000,,301,,,2020-10-07,1,1,BoHoaTh_BinhHoaD_t_1024x1024@2x.jpg
Bó Hoa Roseanne,449000,749000,294,,,2020-10-07,1,1,Bo-Hoa-Roseanne_1024x1024@2x.jpg
Bó Hoa Purple Desire,439000,,419,,,2020-10-07,1,1,BoHoaPurpleDesire_1024x1024@2x.jpg
Bó Hoa Pink Princess,669000,,428,,,2020-10-07,1,1,BoHoaPinkPrincess_c1ac38bc-39bd-4427-9c3b-9bc88d65af15_1024x1024@2x.jpg
Bó Hoa Passionate Heart,419000,,358,,,2020-10-07,1,1,BoHoaPassionateHeart_1024x1024@2x.jpg
Bó Hoa Million Little Things,819000,,378,,,2020-10-07,1,1,bo-hoa-million-little-things-1_1_1024x1024@2x.jpg
Bó Hoa Make Me Smile,369000,,326,,,2020-10-07,1,1,BoHoaMakeMeSmile_1024x1024@2x.jpg
Bó Hoa Love At First Sight,1039000,,283,,,2020-10-07,1,1,bo-hoa-love-at-first-sight-1_1_1024x1024@2x.jpg
Bó Hoa Hướng Dương Shiny Baby,419000,,267,,,2020-10-07,1,1,BoHoaH_ngD_ngShinyBaby_1024x1024@2x.jpg
Bó Hoa Enchanted,1549000,,369,,,2020-10-07,1,1,BoHoaEnchanted_1024x1024@2x.jpg
Bó Hoa Dream Of You,429000,,210,,,2020-10-07,1,1,BoHoaDreamofYou_1024x1024@2x.jpg
Bó Hoa Doors To Heaven,289000,,238,,,2020-10-07,1,1,BoHoaDoorsToHeavenCaoCap-web_1024x1024@2x.jpg
Bó Hoa Dear Daises,769000,,409,,,2020-10-07,1,1,BoHoaDearDaises_1024x1024@2x.jpg
Bó Hoa Cherish Bridal,789000,,404,,,2020-10-07,1,1,BoHoaCherishBridal_1024x1024@2x.jpg
Bó Hoa Be Grateful,529000,,215,,,2020-10-07,1,1,bo-hoa-be-grateful-1_1_1024x1024@2x.jpg
Bó Hoa Autumn Melody,439000,,224,,,2020-10-07,1,1,BoHoaAutumnMelody_1024x1024@2x.jpg
Hộp Hoa Blooms Of Love,1029000,,497,,,2020-10-07,1,1,Blooms-Of-Love_dc2f1bd1-fc27-4f43-b2bd-2a2529aff895_1024x1024@2x.jpg
Bình Hoa Thủy Tinh Loving Me Softly,639000,,387,,,2020-10-07,1,1,BinhHoaTh_yTinhLovingMeSoftly_1024x1024@2x.jpg
Bình Hoa Thủy Tinh Fire For The Soul,679000,,374,,,2020-10-07,1,1,BinhHoaTh_yTinhFireForTheSoul_1024x1024@2x.jpg
Giỏ Hoa Anna's Garden,329000,549000,240,,,2020-10-07,1,1,Anna_sGarden_007c9667-eb30-47d6-b724-b43f2d23c8e5_1024x1024@2x.jpg
Bó Hoa Adorable Smile,199000,,327,,,2020-10-07,1,1,adorablesmileupshopify_1024x1024@2x.jpg
Bó Hoa Hồng Beautiful You,229000,599000,312,,,2020-10-07,1,1,
Bó Hoa Fabulously Red,319000,619000,194,,,2020-10-07,1,1,
Bó Hoa Sway Into Love,279000,489000,431,,,2020-10-07,1,1,
Bó Hoa Hồng La Vie En Rose,299000,499000,293,,,2020-10-07,1,1,
Giỏ Hoa Rose Land,279000,469000,153,,,2020-10-07,1,1,
Hộp Hoa Gỗ Tròn Violet Lover,399000,719000,136,,,2020-10-07,1,1,
Bó Hoa Fly Me To The Moon,339000,619000,468,,,2020-10-07,1,1,
Bó Hoa Hồng Fall For You,399000,669000,210,,,2020-10-07,1,1,
Bó Hoa Aurora Light,419000,,298,,,2020-10-07,1,1,
Bó Hoa Hồng Forever,419000,,362,,,2020-10-07,1,1,
Combo Dear Love,469000,789000,480,,,2020-10-07,1,1,
Hộp Hoa Gỗ Secret Lover,849000,,420,,,2020-10-07,1,1,
Bó Hoa Hồng Always,369000,,486,,,2020-10-07,1,1,
Bó Hoa Hồng Ecuador Red Romance,569000,,187,,,2020-10-07,1,1,
Hộp Hoa Gỗ California Lover,819000,,260,,,2020-10-07,1,1,
Bó Hoa Sweet Velvet,589000,,138,,,2020-10-07,1,1,
Bó Hoa Hồng Pretty in Pink,539000,,409,,,2020-10-07,1,1,
Bó Hoa Love In Rome,419000,,280,,,2020-10-07,1,1,
Hộp Hoa Gỗ Moonlight Lover,789000,,346,,,2020-10-07,1,1,
Giỏ Hoa Hồng Darling Darling,599000,,197,,,2020-10-07,1,1,
Bó Hoa Be Mine,889000,,257,,,2020-10-07,1,1,
Bó Hoa Hồng True Love (99 Bông),1590000,,420,,,2020-10-07,1,1,
Hộp Hoa Gỗ Poetic Lover,759000,,109,,,2020-10-07,1,1,
Bó Hoa Hồng Grand Gesture,529000,,357,,,2020-10-07,1,1,
Combo Wonderful Celebration,699000,,440,,,2020-10-07,1,1,
Bó Hoa Hồng White Magic,379000,,232,,,2020-10-07,1,1,
Bó Hoa Jasmine,449000,,355,,,2020-10-07,1,1,
Hộp Hoa Bí Mật Rosie,399000,639000,478,,,2020-10-07,1,1,
Bó Hoa Spring Day,819000,,293,,,2020-10-07,1,1,
Bó Hoa Wild At Heart,779000,,227,,,2020-10-07,1,1,
Bó Hoa Hồng Ecuador Deeply In Love,119000,,136,,,2020-10-07,1,1,
Giỏ Hoa Intimate Amber,1090000,,194,,,2020-10-07,1,1,
Trà Sữa Nha!,219000,,497,,,2020-10-07,1,1,
Bó Hoa A Million Dreams,749000,,443,,,2020-10-07,1,1,
Hộp Hoa Bí Mật Cotton Candy,399000,639000,259,,,2020-10-07,1,1,
Hộp Hoa Gỗ Flaming Heart,1090000,,245,,,2020-10-07,1,1,
Giỏ Hoa Orange Blossom,469000,,291,,,2020-10-07,1,1,
Bó Hoa Hướng Dương Sunny Morning,229000,,425,,,2020-10-07,1,1,
Bó Hoa Chloe,349000,,139,,,2020-10-07,1,1,
Bó Hoa Hướng Dương Sunset Love,369000,,473,,,2020-10-07,1,1,
Bó Hoa Hướng Dương Sunny Smile,299000,,444,,,2020-10-07,1,1,
Bó Hoa Hướng Dương Sunny Days,319000,,130,,,2020-10-07,1,1,
Giỏ Hoa Be Happy,279000,469000,222,,,2020-10-07,1,1,
Bó Hoa Green Garden,389000,,244,,,2020-10-07,1,1,
Giỏ Hoa Trái Cây Wish You Health,779000,,418,,,2020-10-07,1,1,
Bó Hoa Joyful Life,319000,,322,,,2020-10-07,1,1,
Combo Cuteness Overload,499000,,404,,,2020-10-07,1,1,
Kệ Hoa Time To Cheer,1519000,,327,,,2020-10-07,1,1,
Kệ Hoa Rising Stars,1429000,,212,,,2020-10-07,1,1,
Giỏ Hoa My Beloved Sunnies,679000,,470,,,2020-10-07,1,1,
Hộp Hoa Gỗ Moon River,1259000,,230,,,2020-10-07,1,1,
Combo Feel Like Sunshine,899000,,120,,,2020-10-07,1,1,
Combo Forgive Me,319000,,122,,,2020-10-07,1,1,
Bó Hoa Cẩm Chướng Carla,299000,489000,179,,,2020-10-07,1,1,
Chúc Vui!,229000,,338,,,2020-10-07,1,1,
Bó Hoa Cẩm Chướng Violetta,339000,,166,,,2020-10-07,1,1,
Giỏ Hoa Enchanting Romance,519000,919000,118,,,2020-10-07,1,1,
Hộp Hoa Sherbet Sunset,469000,,402,,,2020-10-07,1,1,
Combo Happy Blue,379000,,124,,,2020-10-07,1,1,
Bó Hoa Crystal Pearl,499000,,390,,,2020-10-07,1,1,
Combo Sweet Heaven,359000,,474,,,2020-10-07,1,1,
Kệ Hoa Infinite Fortune,1329000,,154,,,2020-10-07,1,1,
Kệ Hoa Mighty Joy,1699000,,218,,,2020-10-07,1,1,
Kệ Hoa Summer Shine,1049000,,274,,,2020-10-07,1,1,
Kệ Hoa Lavish Lustre,1479000,,176,,,2020-10-07,1,1,
Bó Hoa Pink Moon,249000,469000,203,,,2020-10-07,1,1,
Em Ơi!,219000,,101,,,2020-10-07,1,1,
Hộp Hoa Coral Pink,479000,889000,113,,,2020-10-07,1,1,
Hộp Hoa Cupid's Kisses,679000,,439,,,2020-10-07,1,1,
Bó Hoa Magical Land,689000,,268,,,2020-10-07,1,1,
Kệ Hoa Golden Times,1649000,,423,,,2020-10-07,1,1,
Kệ Hoa Shining Glory,1519000,,275,,,2020-10-07,1,1,
Vòng Hoa Chia Buồn Soft Whisper,1919000,,322,,,2020-10-07,1,1,
Giỏ Hoa Dreamlike,929000,,164,,,2020-10-07,1,1,
Bó hoa Be My Fiancée,559000,,426,,,2020-10-07,1,1,
Kệ Hoa The Pinnacle Of Success,1219000,,359,,,2020-10-07,1,1,
Kệ Hoa Blushing Blossoms,1019000,,223,,,2020-10-07,1,1,
Combo Tune In For Love,719000,,185,,,2020-10-07,1,1,